<!DOCTYPE game-interactable SYSTEM "interactable.dtd">
<game-interactable id="dad" class="object" style="{=$style}">
    <game-data class="data">
        <game-data-property key="name" value="Old Dad"></game-data-property>
        <game-data-property key="location" value="Living Room"></game-data-property>
        <game-data-action type="inspect">
            <game-logic-action type="output">
                My Dad, ... I like him, but I wish he wasn't as sarcastic.
            </game-logic-action>
        </game-data-action>
        <game-data-action type="talk">
            <game-logic type="all">
                <game-logic-option text="Hey Dad, what do you think about what I'm doing?">
                    <game-logic-action type="output">
                        Old Dad: 'Well, isn't this a surprise! Thought you'd never ask an old man for advice.'
                    </game-logic-action>
                    <game-logic-action type="output">
                        Old Dad: 'Doing? You're almost as busy as a cat on a hot tin roof, just less productive!'
                    </game-logic-action>
                </game-logic-option>
                <game-logic-option text="Come on, Dad, be serious for a second.">
                    <game-logic-action type="output">
                        Old Dad: 'Serious? Alright, I think it's fantastic to see you tackling things head-on, just
                        maybe tackle them a bit softer next time!'
                    </game-logic-action>
                </game-logic-option>
                <game-logic-option text="Oh yeah? And what would make it productive, Oh wise one?">
                    <game-logic-action type="output">
                        Old Dad: 'Wisdom, huh? First rule: never argue with an old man whoâ€™s seen your baby photos!'
                    </game-logic-action>
                </game-logic-option>
            </game-logic>
        </game-data-action>
    </game-data>
    <img
            class="image"
            src="./images/dummy.png"
data-src="./images/objects/dad/dad.png"
            alt=""
    />
    <object
            class="click-area"
            data="./images/dummy.png"
data-data="/public/images/objects/dad/dad.svg"
            type="image/svg+xml"
    > </object>
</game-interactable>
